{
  "id": "tag-manager",
  "label": "Tag Manager",
  "version": "0.1.0",
  "provider": "pass-through",
  "parameters": {
    "github_owner": {
      "type": "string",
      "title": "GitHub Owner",
      "description": "GitHub user or organization that hosts the controlled vocabulary JSON.",
      "default": ""
    },
    "github_repo": {
      "type": "string",
      "title": "GitHub Repository",
      "description": "Repository name that contains the controlled vocabulary JSON.",
      "default": "Zotero_TagVocab"
    },
    "file_path": {
      "type": "string",
      "title": "File Path",
      "description": "Path to the controlled vocabulary JSON inside the repository.",
      "default": "tags/tags.json"
    },
    "github_token": {
      "type": "string",
      "title": "GitHub Token",
      "description": "Bearer token used for both subscribe and publish requests.",
      "default": ""
    }
  },
  "execution": {
    "feedback": {
      "showNotifications": false
    }
  },
  "hooks": {
    "filterInputs": "hooks/filterInputs.js",
    "applyResult": "hooks/applyResult.js"
  }
}
